{
  "schemaVersion": "map.v2",
  "width": 9,
  "height": 9,
  "setupZoneRule": "diagonal-28-v1",
  "cornerRule": "block-if-both-orthogonals-blocked",
  "rulesVersion": "ott-campus.v2",
  "id": "learn-fire",
  "revision": 1,
  "bases": {
    "red": "a1",
    "blue": "i9"
  },
  "blocked": [],
  "terrains": {
    "b2": "fire",
    "e4": "fire",
    "e6": "fire",
    "h8": "fire"
  }
}
