{
  "schemaVersion": "map.v2",
  "width": 9,
  "height": 9,
  "setupZoneRule": "diagonal-28-v1",
  "cornerRule": "block-if-both-orthogonals-blocked",
  "rulesVersion": "ott-campus.v2",
  "id": "learn-water",
  "revision": 1,
  "bases": {
    "red": "a1",
    "blue": "i9"
  },
  "blocked": [],
  "terrains": {
    "c2": "water",
    "d5": "water",
    "f5": "water",
    "g8": "water"
  }
}
